{
  "$schema": "https://json-schema.org/draft/2020-12/schema",
  "$id": "https://xkernels.dev/schema/impl_card.schema.json",
  "title": "Implementation Card",
  "description": "Backend-specific implementation of an Op Spec. Many cards point at one Op Spec. Validated against that Op Spec's one reference + tolerances. See docs/library.md §2.2.",
  "type": "object",
  "required": [
    "id",
    "implements",
    "backend",
    "arch",
    "specialization_knobs",
    "perf",
    "provenance"
  ],
  "additionalProperties": false,
  "properties": {
    "id": {
      "type": "string",
      "description": "'<op_short_name>.<backend>@<semver>', e.g. 'ffn.triton@1.0.0'.",
      "pattern": "^.+\\.(reference|triton|cuda|hip|sycl)@(0|[1-9]\\d*)\\.(0|[1-9]\\d*)\\.(0|[1-9]\\d+)$"
    },
    "implements": {
      "type": "string",
      "description": "The Op Spec id this card satisfies."
    },
    "backend": {
      "type": "string",
      "enum": ["reference", "triton", "cuda", "hip", "sycl"],
      "description": "Maps 1:1 to xkernels._backends.Backend for callable resolution."
    },
    "arch": {
      "type": "object",
      "required": ["family"],
      "additionalProperties": false,
      "properties": {
        "family": {
          "type": "string",
          "description": "Architecture family. 'any' for backend-neutral (e.g. reference, or portable Triton). nvidia_sm100 = Blackwell data-center (B100/B200); nvidia_sm121 = Grace+Blackwell GB10 (CUTE DSL test bed).",
          "enum": [
            "any",
            "nvidia_sm80",
            "nvidia_sm90",
            "nvidia_sm100",
            "nvidia_sm121",
            "amd_cdna2",
            "amd_cdna3"
          ]
        },
        "requires": {
          "type": "array",
          "items": { "type": "string" },
          "description": "Hardware features needed, e.g. ['tensor_cores','tma'] (NVIDIA) or ['matrix_cores','mfma'] (AMD)."
        },
        "wave_size": {
          "type": "integer",
          "enum": [0, 32, 64],
          "description": "32 (NVIDIA warp) | 64 (AMD wavefront) | 0 (agnostic). Never hardcode 32 in a kernel above this card."
        },
        "scratch": {
          "type": "object",
          "additionalProperties": false,
          "properties": {
            "kind": { "type": "string", "enum": ["smem", "lds", "none", "registers"] },
            "bytes": { "type": "integer", "minimum": 0 }
          }
        }
      }
    },
    "specialization_knobs": {
      "type": "object",
      "description": "Per-backend tuning space. Map of knob name -> {type, choices} (or {type:'int', min, max} for ranges). Empty for reference.",
      "additionalProperties": {
        "type": "object",
        "required": ["type"],
        "properties": {
          "type": { "type": "string", "enum": ["int", "bool"] },
          "choices": { "type": "array", "items": {} },
          "min": { "type": "integer" },
          "max": { "type": "integer" }
        }
      }
    },
    "perf": {
      "type": "object",
      "required": ["roofline"],
      "additionalProperties": false,
      "properties": {
        "regime": { "type": "string", "description": "Free-form per-arch regime hint, e.g. 'memory-bound tall-skinny'." },
        "roofline": {
          "type": "string",
          "enum": ["compute_bound", "memory_bound", "latency_bound", "unknown"]
        },
        "measured": {
          "type": "array",
          "description": "Write-back measurements. Each MUST cite a reproducible `source` run id and an `arch`; un-sourced or arch-less entries are dropped by the loader.",
          "items": {
            "type": "object",
            "required": ["arch", "shape", "dtype", "knobs", "source"],
            "additionalProperties": false,
            "properties": {
              "arch": { "type": "string" },
              "shape": { "type": "object" },
              "dtype": { "type": "string" },
              "knobs": { "type": "object" },
              "tflops": { "type": ["number", "null"], "minimum": 0 },
              "achieved_bw_pct": { "type": ["number", "null"], "minimum": 0 },
              "ms": { "type": ["number", "null"], "minimum": 0 },
              "source": { "type": "string", "description": "Reproducible run id, e.g. 'run:2026-06-25T10:00:00Z#abc123'." }
            }
          }
        }
      }
    },
    "uses_primitives": {
      "type": "array",
      "items": { "type": "string" },
      "description": "Primitive ids this card is assembled from. Enables bug-traceability across cards/backends."
    },
    "supersedes": {
      "type": "array",
      "items": { "type": "string" },
      "description": "Impl card ids this one replaces (lineage)."
    },
    "provenance": {
      "type": "object",
      "required": ["authored_by", "created", "source_path"],
      "additionalProperties": false,
      "properties": {
        "authored_by": {
          "type": "string",
          "enum": ["human", "agent", "hybrid", "dsl"],
          "description": "Who authored the card. 'dsl' = generated by the vkl DSL emitter (docs/brainstorm/); contract-identical to a hand-written card."
        },
        "skill_used": { "type": "array", "items": { "type": "string" } },
        "derived_from": { "type": "string", "description": "Impl card id this was ported/derived from." },
        "issue": { "type": "array", "items": { "type": "integer", "minimum": 1 }, "description": "GitHub issue number(s) this card resolves or refs (AGENTS.md: record the issue number in any new/changed card's provenance.issue)." },
        "created": { "type": "string", "description": "ISO-8601 timestamp." },
        "source_path": { "type": "string", "description": "Repo-relative path to the source the card describes." },
        "tuning_trace": {
          "type": "array",
          "description": "Namespaced vkl compounding artifact (docs/brainstorm/09 §6). Append-only log of edit steps; the next run reads it to skip dead-ends. Each entry: {step, edit, target, args, check, predicted, measured}. Ignored by the bottom (JSON-only) consumption tier.",
          "items": {
            "type": "object",
            "additionalProperties": true,
            "properties": {
              "step": { "type": "integer", "minimum": 0 },
              "edit": { "type": "string" },
              "target": { "type": "string" },
              "args": { "type": "object" },
              "check": { "type": "string", "enum": ["ok", "reject"] },
              "predicted": { "type": "object" },
              "measured": { "type": "object" }
            }
          }
        }
      }
    },
    "launch": {
      "type": "object",
      "description": "Namespaced vkl launch/orchestration metadata (docs/brainstorm/07 §7). The bottom tier ignores it; a graph-aware runtime uses launch.graph to capture. additionalProperties left open so future launch modes stream-add without a schema bump.",
      "additionalProperties": true,
      "properties": {
        "graph": { "type": "boolean", "description": "True if this card is a captured CUDA/HIP graph rather than a single launch." },
        "nodes": { "type": "array", "items": { "type": "string" }, "description": "Ordered kernel node ids in the graph." },
        "params": { "type": "array", "items": { "type": "string" }, "description": "Runtime-varying args → graph parameter nodes." }
      }
    },
    "persistent": {
      "type": "object",
      "description": "Optional namespaced block for persistent-grid / on-chip dataflow orchestration metadata (e.g. warp roles, register budget, pipeline stages, defused edges) for fused or persistent-grid kernels. Peer of `launch` (which covers CUDA/HIP-graph capture); the bottom JSON tier ignores it. additionalProperties left open because this structure is in flux (WIP mega-kernel cards), so no sub-field types are pinned here.",
      "additionalProperties": true
    },
    "notes": {
      "type": "string",
      "description": "Free-form agent/human notes (e.g. portability caveats: wave-size 32 vs 64 is not load-bearing here)."
    }
  }
}
