{
  "id": "packed_silu_and_mul.reference@1.0.0",
  "implements": "packed_silu_and_mul@1.0.0",
  "backend": "reference",
  "arch": {
    "family": "any",
    "requires": [],
    "wave_size": 0,
    "scratch": {
      "kind": "none",
      "bytes": 0
    }
  },
  "specialization_knobs": {},
  "perf": {
    "regime": "pure-torch auto-reference: the @kernel body on torch.",
    "roofline": "latency_bound",
    "measured": []
  },
  "uses_primitives": [],
  "supersedes": [],
  "provenance": {
    "authored_by": "dsl",
    "created": "2026-07-02T09:53:00+00:00",
    "source_path": "xkernels.vkl:packed_silu_and_mul"
  }
}
