{
  "arch": {
    "family": "any",
    "requires": [],
    "scratch": {
      "bytes": 0,
      "kind": "none"
    },
    "wave_size": 0
  },
  "backend": "reference",
  "id": "paged_kv_gather.reference@1.0.0",
  "implements": "paged_kv_gather@1.0.0",
  "perf": {
    "measured": [],
    "regime": "pure-torch auto-reference: the @kernel body on torch.",
    "roofline": "latency_bound"
  },
  "provenance": {
    "authored_by": "dsl",
    "created": "2026-07-02T06:29:48+00:00",
    "source_path": "xkernels.vkl:paged_kv_gather"
  },
  "specialization_knobs": {},
  "supersedes": [],
  "uses_primitives": []
}