{
  "id": "sparse_mla_attention.reference@1.0.0",
  "implements": "sparse_mla_attention@1.0.0",
  "backend": "reference",
  "arch": { "family": "any", "wave_size": 0, "scratch": { "kind": "none", "bytes": 0 } },
  "specialization_knobs": {},
  "perf": {
    "regime": "pure-torch oracle: per-token softmax over the indexer-selected latent KV (online max/denom/value accumulator). Written for clarity, not speed.",
    "roofline": "latency_bound"
  },
  "uses_primitives": [],
  "supersedes": [],
  "provenance": {
    "authored_by": "human",
    "created": "2026-06-25T00:00:00Z",
    "source_path": "src/xkernels/ops/attention/sparse_mla_reference.py"
  }
}
