{
  "id": "mha_merge_state.reference@1.0.0",
  "implements": "mha_merge_state@1.0.0",
  "backend": "reference",
  "arch": { "family": "any", "wave_size": 0, "scratch": { "kind": "none", "bytes": 0 } },
  "specialization_knobs": {},
  "perf": {
    "regime": "pure-torch oracle: fp32 log-sum-exp combine of two partials.",
    "roofline": "latency_bound"
  },
  "uses_primitives": [],
  "supersedes": [],
  "provenance": {
    "authored_by": "human",
    "created": "2026-06-25T00:00:00Z",
    "source_path": "src/xkernels/ops/attention/reference.py"
  }
}
