{
  "id": "fused_ffn.reference@1.0.0",
  "implements": "fused_ffn@1.0.0",
  "backend": "reference",
  "arch": { "family": "any", "wave_size": 0, "scratch": { "kind": "none", "bytes": 0 } },
  "specialization_knobs": {},
  "perf": {
    "regime": "pure-torch oracle; three sequential matmuls + eager SwiGLU. Not optimized — the correctness baseline, not a performance target.",
    "roofline": "latency_bound"
  },
  "uses_primitives": [],
  "supersedes": [],
  "provenance": {
    "authored_by": "human",
    "created": "2026-06-25T00:00:00Z",
    "source_path": "src/xkernels/ops/ffn/reference.py",
    "issue": [82]
  }
}
